query,gene_set,Bhattacharya_ID,blast_hit,evalue,ProteinNames,BiologicalProcess,GOs,CellularComponent,MolecularFunction,short_name
Pocillopora_acuta_HIv2___RNAseq.g16433.t1,calcium,,B8UU59,0,Polycystin-1-related protein (Polycystic kidney disease 1-related protein),calcium ion transport [GO:0006816],GO:0005261; GO:0005886; GO:0005929; GO:0006816,cilium [GO:0005929]; plasma membrane [GO:0005886],monoatomic cation channel activity [GO:0005261],Polycystin-1-related protein
Pocillopora_acuta_HIv2___RNAseq.g16790.t1,calcium,,Q00959,2.27e-47,"Glutamate receptor ionotropic, NMDA 2A (GluN2A) (Glutamate [NMDA] receptor subunit epsilon-1) (N-methyl D-aspartate receptor subtype 2A) (NMDAR2A) (NR2A)","action potential [GO:0001508]; auditory behavior [GO:0031223]; calcium ion transmembrane import into cytosol [GO:0097553]; calcium ion transmembrane transport [GO:0070588]; calcium ion transport [GO:0006816]; cellular response to amino acid stimulus [GO:0071230]; cellular response to dsRNA [GO:0071359]; cellular response to glycine [GO:1905430]; cellular response to growth factor stimulus [GO:0071363]; cellular response to lipid [GO:0071396]; cellular response to magnesium ion [GO:0071286]; cellular response to manganese ion [GO:0071287]; cellular response to zinc ion [GO:0071294]; cerebral cortex development [GO:0021987]; chemical synaptic transmission [GO:0007268]; conditioned place preference [GO:1990708]; dendritic spine organization [GO:0097061]; directional locomotion [GO:0033058]; dopamine metabolic process [GO:0042417]; excitatory postsynaptic potential [GO:0060079]; glutamate receptor signaling pathway [GO:0007215]; hippocampus development [GO:0021766]; ionotropic glutamate receptor signaling pathway [GO:0035235]; learning [GO:0007612]; learning or memory [GO:0007611]; locomotion [GO:0040011]; long-term synaptic potentiation [GO:0060291]; memory [GO:0007613]; modulation of chemical synaptic transmission [GO:0050804]; modulation of excitatory postsynaptic potential [GO:0098815]; monoatomic cation transmembrane transport [GO:0098655]; multicellular organismal response to stress [GO:0033555]; negative regulation of protein catabolic process [GO:0042177]; neurogenesis [GO:0022008]; neuron development [GO:0048666]; neurotransmitter receptor transport, plasma membrane to endosome [GO:0099646]; positive regulation of apoptotic process [GO:0043065]; positive regulation of excitatory postsynaptic potential [GO:2000463]; positive regulation of inhibitory postsynaptic potential [GO:0097151]; positive regulation of protein targeting to membrane [GO:0090314]; positive regulation of synaptic transmission, glutamatergic [GO:0051968]; protein catabolic process [GO:0030163]; protein localization to postsynaptic membrane [GO:1903539]; receptor recycling [GO:0001881]; regulation of ARF protein signal transduction [GO:0032012]; regulation of long-term neuronal synaptic plasticity [GO:0048169]; regulation of membrane potential [GO:0042391]; regulation of monoatomic cation transmembrane transport [GO:1904062]; regulation of neuronal synaptic plasticity [GO:0048168]; regulation of NMDA receptor activity [GO:2000310]; regulation of postsynaptic membrane potential [GO:0060078]; regulation of response to alcohol [GO:1901419]; regulation of synaptic plasticity [GO:0048167]; response to amine [GO:0014075]; response to ammonium ion [GO:0060359]; response to amphetamine [GO:0001975]; response to calcium ion [GO:0051592]; response to carbohydrate [GO:0009743]; response to cocaine [GO:0042220]; response to environmental enrichment [GO:0090648]; response to ethanol [GO:0045471]; response to fungicide [GO:0060992]; response to glycoside [GO:1903416]; response to hydrogen sulfide [GO:1904880]; response to lead ion [GO:0010288]; response to light stimulus [GO:0009416]; response to lithium ion [GO:0010226]; response to manganese ion [GO:0010042]; response to methylmercury [GO:0051597]; response to nicotine [GO:0035094]; response to other organism [GO:0051707]; response to wounding [GO:0009611]; response to xenobiotic stimulus [GO:0009410]; rhythmic process [GO:0048511]; sensory perception of pain [GO:0019233]; serotonin metabolic process [GO:0042428]; sleep [GO:0030431]; sodium ion transmembrane transport [GO:0035725]; spinal cord development [GO:0021510]; startle response [GO:0001964]; synaptic transmission, glutamatergic [GO:0035249]; visual learning [GO:0008542]",GO:0001508; GO:0001881; GO:0001964; GO:0001975; GO:0004970; GO:0004972; GO:0005102; GO:0005261; GO:0005262; GO:0005737; GO:0005783; GO:0005789; GO:0005886; GO:0006816; GO:0007215; GO:0007268; GO:0007611; GO:0007612; GO:0007613; GO:0008021; GO:0008270; GO:0008542; GO:0009410; GO:0009416; GO:0009611; GO:0009743; GO:0009986; GO:0010042; GO:0010226; GO:0010288; GO:0014069; GO:0014075; GO:0016020; GO:0016595; GO:0017146; GO:0019233; GO:0019901; GO:0021510; GO:0021766; GO:0021987; GO:0022008; GO:0022843; GO:0022849; GO:0030163; GO:0030431; GO:0030659; GO:0031223; GO:0032012; GO:0032590; GO:0033058; GO:0033555; GO:0035094; GO:0035235; GO:0035249; GO:0035254; GO:0035725; GO:0040011; GO:0042177; GO:0042220; GO:0042391; GO:0042417; GO:0042428; GO:0042734; GO:0043005; GO:0043065; GO:0043195; GO:0043197; GO:0044877; GO:0045202; GO:0045211; GO:0045471; GO:0048167; GO:0048168; GO:0048169; GO:0048306; GO:0048511; GO:0048666; GO:0050804; GO:0050839; GO:0051117; GO:0051592; GO:0051597; GO:0051707; GO:0051968; GO:0060078; GO:0060079; GO:0060291; GO:0060359; GO:0060992; GO:0070588; GO:0071230; GO:0071286; GO:0071287; GO:0071294; GO:0071359; GO:0071363; GO:0071396; GO:0090314; GO:0090648; GO:0097060; GO:0097061; GO:0097110; GO:0097151; GO:0097553; GO:0098655; GO:0098688; GO:0098794; GO:0098815; GO:0098839; GO:0098978; GO:0099092; GO:0099507; GO:0099646; GO:1901419; GO:1903416; GO:1903539; GO:1904062; GO:1904315; GO:1904880; GO:1905430; GO:1990708; GO:1990782; GO:2000310; GO:2000463,"cell surface [GO:0009986]; cytoplasm [GO:0005737]; cytoplasmic vesicle membrane [GO:0030659]; dendrite membrane [GO:0032590]; dendritic spine [GO:0043197]; endoplasmic reticulum [GO:0005783]; endoplasmic reticulum membrane [GO:0005789]; glutamatergic synapse [GO:0098978]; membrane [GO:0016020]; neuron projection [GO:0043005]; NMDA selective glutamate receptor complex [GO:0017146]; parallel fiber to Purkinje cell synapse [GO:0098688]; plasma membrane [GO:0005886]; postsynapse [GO:0098794]; postsynaptic density [GO:0014069]; postsynaptic density membrane [GO:0098839]; postsynaptic density, intracellular component [GO:0099092]; postsynaptic membrane [GO:0045211]; presynaptic membrane [GO:0042734]; synapse [GO:0045202]; synaptic membrane [GO:0097060]; synaptic vesicle [GO:0008021]; terminal bouton [GO:0043195]",ATPase binding [GO:0051117]; calcium channel activity [GO:0005262]; calcium-dependent protein binding [GO:0048306]; cell adhesion molecule binding [GO:0050839]; glutamate binding [GO:0016595]; glutamate receptor binding [GO:0035254]; glutamate-gated calcium ion channel activity [GO:0022849]; glutamate-gated receptor activity [GO:0004970]; ligand-gated monoatomic ion channel activity involved in regulation of presynaptic membrane potential [GO:0099507]; monoatomic cation channel activity [GO:0005261]; NMDA glutamate receptor activity [GO:0004972]; protein kinase binding [GO:0019901]; protein tyrosine kinase binding [GO:1990782]; protein-containing complex binding [GO:0044877]; scaffold protein binding [GO:0097110]; signaling receptor binding [GO:0005102]; transmitter-gated monoatomic ion channel activity involved in regulation of postsynaptic membrane potential [GO:1904315]; voltage-gated monoatomic cation channel activity [GO:0022843]; zinc ion binding [GO:0008270],"Glutamate receptor ionotropic, NMDA 2A"
Pocillopora_acuta_HIv2___RNAseq.g17157.t1,calcium,,P43125,0,Protein retinal degeneration B (Probable calcium transporter rdgB),"calcium ion transport [GO:0006816]; cellular response to light stimulus [GO:0071482]; G protein-coupled opsin signaling pathway [GO:0016056]; negative regulation of opsin-mediated signaling pathway [GO:0016059]; phosphatidylinositol metabolic process [GO:0046488]; phospholipid transport [GO:0015914]; phototransduction [GO:0007602]; phototransduction, visible light [GO:0007603]; sensory perception of smell [GO:0007608]; visual perception [GO:0007601]",GO:0005737; GO:0005886; GO:0006816; GO:0007601; GO:0007602; GO:0007603; GO:0007608; GO:0008525; GO:0008526; GO:0015914; GO:0016020; GO:0016029; GO:0016056; GO:0016059; GO:0031210; GO:0035091; GO:0046488; GO:0046872; GO:0070300; GO:0071482; GO:1990050,cytoplasm [GO:0005737]; membrane [GO:0016020]; plasma membrane [GO:0005886]; subrhabdomeral cisterna [GO:0016029],metal ion binding [GO:0046872]; phosphatidic acid binding [GO:0070300]; phosphatidic acid transfer activity [GO:1990050]; phosphatidylcholine binding [GO:0031210]; phosphatidylcholine transporter activity [GO:0008525]; phosphatidylinositol binding [GO:0035091]; phosphatidylinositol transfer activity [GO:0008526],Protein retinal degeneration B
Pocillopora_acuta_HIv2___RNAseq.g17158.t1,"calcium, Bhattacharya2016",P2RX3,Q99571,1.31e-139,P2X purinoceptor 4 (P2X4) (ATP receptor) (Purinergic receptor),apoptotic signaling pathway [GO:0097190]; behavioral response to pain [GO:0048266]; calcium ion transmembrane transport [GO:0070588]; calcium-mediated signaling [GO:0019722]; cellular response to ATP [GO:0071318]; cellular response to zinc ion [GO:0071294]; endothelial cell activation [GO:0042118]; membrane depolarization [GO:0051899]; monoatomic ion transmembrane transport [GO:0034220]; negative regulation of cardiac muscle hypertrophy [GO:0010614]; positive regulation of blood vessel endothelial cell migration [GO:0043536]; positive regulation of calcium ion transport [GO:0051928]; positive regulation of calcium ion transport into cytosol [GO:0010524]; positive regulation of calcium-mediated signaling [GO:0050850]; positive regulation of endothelial cell chemotaxis [GO:2001028]; positive regulation of microglial cell migration [GO:1904141]; positive regulation of nitric oxide biosynthetic process [GO:0045429]; positive regulation of phosphatidylinositol 3-kinase/protein kinase B signal transduction [GO:0051897]; positive regulation of prostaglandin secretion [GO:0032308]; purinergic nucleotide receptor signaling pathway [GO:0035590]; regulation of blood pressure [GO:0008217]; regulation of cardiac muscle contraction [GO:0055117]; regulation of chemotaxis [GO:0050920]; regulation of sodium ion transport [GO:0002028]; relaxation of cardiac muscle [GO:0055119]; response to ATP [GO:0033198]; response to axon injury [GO:0048678]; response to fluid shear stress [GO:0034405]; response to ischemia [GO:0002931]; sensory perception of pain [GO:0019233]; sensory perception of touch [GO:0050975]; signal transduction [GO:0007165]; tissue homeostasis [GO:0001894],GO:0001614; GO:0001894; GO:0002028; GO:0002931; GO:0004931; GO:0005102; GO:0005507; GO:0005524; GO:0005765; GO:0005886; GO:0007165; GO:0008217; GO:0008270; GO:0010524; GO:0010614; GO:0016020; GO:0019233; GO:0019722; GO:0030054; GO:0032308; GO:0033198; GO:0034220; GO:0034405; GO:0035590; GO:0042118; GO:0042802; GO:0043536; GO:0044297; GO:0045296; GO:0045429; GO:0048266; GO:0048471; GO:0048678; GO:0050850; GO:0050920; GO:0050975; GO:0051897; GO:0051899; GO:0051928; GO:0055117; GO:0055119; GO:0070062; GO:0070588; GO:0071294; GO:0071318; GO:0097190; GO:0098794; GO:0099604; GO:1904141; GO:2001028,cell body [GO:0044297]; cell junction [GO:0030054]; extracellular exosome [GO:0070062]; lysosomal membrane [GO:0005765]; membrane [GO:0016020]; perinuclear region of cytoplasm [GO:0048471]; plasma membrane [GO:0005886]; postsynapse [GO:0098794],ATP binding [GO:0005524]; cadherin binding [GO:0045296]; copper ion binding [GO:0005507]; extracellularly ATP-gated monoatomic cation channel activity [GO:0004931]; identical protein binding [GO:0042802]; ligand-gated calcium channel activity [GO:0099604]; purinergic nucleotide receptor activity [GO:0001614]; signaling receptor binding [GO:0005102]; zinc ion binding [GO:0008270],P2RX3
Pocillopora_acuta_HIv2___RNAseq.g17180.t1,"calcium, Bhattacharya2016",P2RX4,Q99571,7.1e-134,P2X purinoceptor 4 (P2X4) (ATP receptor) (Purinergic receptor),apoptotic signaling pathway [GO:0097190]; behavioral response to pain [GO:0048266]; calcium ion transmembrane transport [GO:0070588]; calcium-mediated signaling [GO:0019722]; cellular response to ATP [GO:0071318]; cellular response to zinc ion [GO:0071294]; endothelial cell activation [GO:0042118]; membrane depolarization [GO:0051899]; monoatomic ion transmembrane transport [GO:0034220]; negative regulation of cardiac muscle hypertrophy [GO:0010614]; positive regulation of blood vessel endothelial cell migration [GO:0043536]; positive regulation of calcium ion transport [GO:0051928]; positive regulation of calcium ion transport into cytosol [GO:0010524]; positive regulation of calcium-mediated signaling [GO:0050850]; positive regulation of endothelial cell chemotaxis [GO:2001028]; positive regulation of microglial cell migration [GO:1904141]; positive regulation of nitric oxide biosynthetic process [GO:0045429]; positive regulation of phosphatidylinositol 3-kinase/protein kinase B signal transduction [GO:0051897]; positive regulation of prostaglandin secretion [GO:0032308]; purinergic nucleotide receptor signaling pathway [GO:0035590]; regulation of blood pressure [GO:0008217]; regulation of cardiac muscle contraction [GO:0055117]; regulation of chemotaxis [GO:0050920]; regulation of sodium ion transport [GO:0002028]; relaxation of cardiac muscle [GO:0055119]; response to ATP [GO:0033198]; response to axon injury [GO:0048678]; response to fluid shear stress [GO:0034405]; response to ischemia [GO:0002931]; sensory perception of pain [GO:0019233]; sensory perception of touch [GO:0050975]; signal transduction [GO:0007165]; tissue homeostasis [GO:0001894],GO:0001614; GO:0001894; GO:0002028; GO:0002931; GO:0004931; GO:0005102; GO:0005507; GO:0005524; GO:0005765; GO:0005886; GO:0007165; GO:0008217; GO:0008270; GO:0010524; GO:0010614; GO:0016020; GO:0019233; GO:0019722; GO:0030054; GO:0032308; GO:0033198; GO:0034220; GO:0034405; GO:0035590; GO:0042118; GO:0042802; GO:0043536; GO:0044297; GO:0045296; GO:0045429; GO:0048266; GO:0048471; GO:0048678; GO:0050850; GO:0050920; GO:0050975; GO:0051897; GO:0051899; GO:0051928; GO:0055117; GO:0055119; GO:0070062; GO:0070588; GO:0071294; GO:0071318; GO:0097190; GO:0098794; GO:0099604; GO:1904141; GO:2001028,cell body [GO:0044297]; cell junction [GO:0030054]; extracellular exosome [GO:0070062]; lysosomal membrane [GO:0005765]; membrane [GO:0016020]; perinuclear region of cytoplasm [GO:0048471]; plasma membrane [GO:0005886]; postsynapse [GO:0098794],ATP binding [GO:0005524]; cadherin binding [GO:0045296]; copper ion binding [GO:0005507]; extracellularly ATP-gated monoatomic cation channel activity [GO:0004931]; identical protein binding [GO:0042802]; ligand-gated calcium channel activity [GO:0099604]; purinergic nucleotide receptor activity [GO:0001614]; signaling receptor binding [GO:0005102]; zinc ion binding [GO:0008270],P2RX4
Pocillopora_acuta_HIv2___RNAseq.g17237.t2,calcium,,Q8C5L6,3.42e-75,"Inositol polyphosphate 5-phosphatase K (EC 3.1.3.56) (Phosphatidylinositol-3,4,5-trisphosphate 5-phosphatase) (EC 3.1.3.86) (Phosphatidylinositol-4,5-bisphosphate 5-phosphatase) (EC 3.1.3.36) (Skeletal muscle and kidney-enriched inositol phosphatase)",cellular response to cAMP [GO:0071320]; cellular response to epidermal growth factor stimulus [GO:0071364]; cellular response to hormone stimulus [GO:0032870]; cellular response to insulin stimulus [GO:0032869]; cellular response to tumor necrosis factor [GO:0071356]; G protein-coupled receptor signaling pathway [GO:0007186]; glucose homeostasis [GO:0042593]; in utero embryonic development [GO:0001701]; negative regulation by host of viral transcription [GO:0043922]; negative regulation of calcium ion transport [GO:0051926]; negative regulation of D-glucose transmembrane transport [GO:0010829]; negative regulation of dephosphorylation [GO:0035305]; negative regulation of DNA-templated transcription [GO:0045892]; negative regulation of glycogen biosynthetic process [GO:0045719]; negative regulation of insulin receptor signaling pathway [GO:0046627]; negative regulation of phosphatidylinositol 3-kinase/protein kinase B signal transduction [GO:0051898]; negative regulation of protein targeting to membrane [GO:0090315]; negative regulation of single stranded viral RNA replication via double stranded DNA intermediate [GO:0045869]; negative regulation of stress fiber assembly [GO:0051497]; phosphatidylinositol dephosphorylation [GO:0046856]; positive regulation of DNA-templated transcription [GO:0045893]; positive regulation of renal water transport [GO:2001153]; positive regulation of urine volume [GO:0035810]; protein localization to plasma membrane [GO:0072659]; regulation of glycogen biosynthetic process [GO:0005979]; response to insulin [GO:0032868]; ruffle assembly [GO:0097178],GO:0001701; GO:0001726; GO:0004439; GO:0005000; GO:0005634; GO:0005737; GO:0005783; GO:0005802; GO:0005829; GO:0005886; GO:0005979; GO:0007186; GO:0010829; GO:0016020; GO:0016312; GO:0032587; GO:0032868; GO:0032869; GO:0032870; GO:0034485; GO:0034594; GO:0034595; GO:0035305; GO:0035810; GO:0042593; GO:0043005; GO:0043922; GO:0045719; GO:0045869; GO:0045892; GO:0045893; GO:0046030; GO:0046627; GO:0046856; GO:0048471; GO:0051497; GO:0051898; GO:0051926; GO:0052658; GO:0052659; GO:0071320; GO:0071356; GO:0071364; GO:0072659; GO:0090315; GO:0097178; GO:2001153,cytoplasm [GO:0005737]; cytosol [GO:0005829]; endoplasmic reticulum [GO:0005783]; membrane [GO:0016020]; neuron projection [GO:0043005]; nucleus [GO:0005634]; perinuclear region of cytoplasm [GO:0048471]; plasma membrane [GO:0005886]; ruffle [GO:0001726]; ruffle membrane [GO:0032587]; trans-Golgi network [GO:0005802],"inositol bisphosphate phosphatase activity [GO:0016312]; inositol trisphosphate phosphatase activity [GO:0046030]; inositol-1,3,4,5-tetrakisphosphate 5-phosphatase activity [GO:0052659]; inositol-1,4,5-trisphosphate 5-phosphatase activity [GO:0052658]; phosphatidylinositol phosphate 5-phosphatase activity [GO:0034595]; phosphatidylinositol trisphosphate phosphatase activity [GO:0034594]; phosphatidylinositol-3,4,5-trisphosphate 5-phosphatase activity [GO:0034485]; phosphatidylinositol-4,5-bisphosphate 5-phosphatase activity [GO:0004439]; vasopressin receptor activity [GO:0005000]",Inositol polyphosphate 5-phosphatase K
Pocillopora_acuta_HIv2___RNAseq.g17391.t1,SLC25,,Q5SVS4,1.46e-130,Kidney mitochondrial carrier protein 1 (Solute carrier family 25 member 30) (Uncoupling protein 6),inorganic anion transport [GO:0015698],GO:0005452; GO:0005739; GO:0005743; GO:0015698; GO:0022857,mitochondrial inner membrane [GO:0005743]; mitochondrion [GO:0005739],solute:inorganic anion antiporter activity [GO:0005452]; transmembrane transporter activity [GO:0022857],Kidney mitochondrial carrier protein 1
Pocillopora_acuta_HIv2___RNAseq.g17580.t1,calcium,,Q01484,2.35e-25,Ankyrin-2 (ANK-2) (Ankyrin-B) (Brain ankyrin) (Non-erythroid ankyrin),atrial cardiac muscle cell action potential [GO:0086014]; atrial cardiac muscle cell to AV node cell communication [GO:0086066]; atrial septum development [GO:0003283]; endocytosis [GO:0006897]; intracellular calcium ion homeostasis [GO:0006874]; membrane depolarization during SA node cell action potential [GO:0086046]; paranodal junction assembly [GO:0030913]; positive regulation of calcium ion transport [GO:0051928]; positive regulation of gene expression [GO:0010628]; positive regulation of potassium ion import across plasma membrane [GO:1903288]; protein localization [GO:0008104]; protein localization to cell surface [GO:0034394]; protein localization to endoplasmic reticulum [GO:0070972]; protein localization to M-band [GO:0036309]; protein localization to organelle [GO:0033365]; protein localization to plasma membrane [GO:0072659]; protein localization to T-tubule [GO:0036371]; protein stabilization [GO:0050821]; protein transport [GO:0015031]; regulation of atrial cardiac muscle cell action potential [GO:0098910]; regulation of calcium ion transport [GO:0051924]; regulation of cardiac muscle cell contraction [GO:0086004]; regulation of cardiac muscle contraction [GO:0055117]; regulation of cardiac muscle contraction by calcium ion signaling [GO:0010882]; regulation of cardiac muscle contraction by regulation of the release of sequestered calcium ion [GO:0010881]; regulation of heart rate [GO:0002027]; regulation of heart rate by cardiac conduction [GO:0086091]; regulation of protein stability [GO:0031647]; regulation of release of sequestered calcium ion into cytosol [GO:0051279]; regulation of SA node cell action potential [GO:0098907]; regulation of ventricular cardiac muscle cell membrane repolarization [GO:0060307]; response to methylmercury [GO:0051597]; SA node cell action potential [GO:0086015]; SA node cell to atrial cardiac muscle cell communication [GO:0086070]; sarcoplasmic reticulum calcium ion transport [GO:0070296]; T-tubule organization [GO:0033292]; ventricular cardiac muscle cell action potential [GO:0086005],GO:0002027; GO:0003283; GO:0005200; GO:0005739; GO:0005764; GO:0005769; GO:0005829; GO:0005856; GO:0005886; GO:0006874; GO:0006897; GO:0008093; GO:0008104; GO:0010628; GO:0010881; GO:0010882; GO:0014704; GO:0015031; GO:0016323; GO:0016324; GO:0019899; GO:0019901; GO:0030018; GO:0030315; GO:0030507; GO:0030674; GO:0030913; GO:0031430; GO:0031647; GO:0031672; GO:0033292; GO:0033365; GO:0034394; GO:0036309; GO:0036371; GO:0042383; GO:0043005; GO:0043034; GO:0044325; GO:0045211; GO:0050821; GO:0051117; GO:0051279; GO:0051597; GO:0051924; GO:0051928; GO:0055037; GO:0055117; GO:0060307; GO:0070296; GO:0070972; GO:0072659; GO:0086004; GO:0086005; GO:0086014; GO:0086015; GO:0086046; GO:0086066; GO:0086070; GO:0086091; GO:0098907; GO:0098910; GO:0099103; GO:0099104; GO:0140031; GO:1903288,A band [GO:0031672]; apical plasma membrane [GO:0016324]; basolateral plasma membrane [GO:0016323]; costamere [GO:0043034]; cytoskeleton [GO:0005856]; cytosol [GO:0005829]; early endosome [GO:0005769]; intercalated disc [GO:0014704]; lysosome [GO:0005764]; M band [GO:0031430]; mitochondrion [GO:0005739]; neuron projection [GO:0043005]; plasma membrane [GO:0005886]; postsynaptic membrane [GO:0045211]; recycling endosome [GO:0055037]; sarcolemma [GO:0042383]; T-tubule [GO:0030315]; Z disc [GO:0030018],ATPase binding [GO:0051117]; channel activator activity [GO:0099103]; cytoskeletal anchor activity [GO:0008093]; enzyme binding [GO:0019899]; phosphorylation-dependent protein binding [GO:0140031]; potassium channel activator activity [GO:0099104]; protein kinase binding [GO:0019901]; protein-macromolecule adaptor activity [GO:0030674]; spectrin binding [GO:0030507]; structural constituent of cytoskeleton [GO:0005200]; transmembrane transporter binding [GO:0044325],Ankyrin-2
Pocillopora_acuta_HIv2___RNAseq.g17848.t1,Bhattacharya2016,NA,Q5F364,0,Multidrug resistance-associated protein 1 (EC 7.6.2.2) (ATP-binding cassette sub-family C member 1) (Glutathione-S-conjugate-translocating ATPase ABCC1) (EC 7.6.2.3) (Leukotriene C(4) transporter) (LTC4 transporter),cyclic nucleotide transport [GO:0070729]; glutathione transmembrane transport [GO:0034775]; lipid transport [GO:0006869]; xenobiotic transport [GO:0042908],GO:0005524; GO:0006869; GO:0008559; GO:0016323; GO:0016887; GO:0034634; GO:0034775; GO:0042908; GO:0070729,basolateral plasma membrane [GO:0016323],ABC-type xenobiotic transporter activity [GO:0008559]; ATP binding [GO:0005524]; ATP hydrolysis activity [GO:0016887]; glutathione transmembrane transporter activity [GO:0034634],NA
Pocillopora_acuta_HIv2___RNAseq.g17850.t3,Bhattacharya2016,ATP1A1,P13607,0,Sodium/potassium-transporting ATPase subunit alpha (Na(+)/K(+) ATPase alpha subunit) (EC 7.2.2.13) (Sodium pump subunit alpha),"adult locomotory behavior [GO:0008344]; chemical synaptic transmission [GO:0007268]; determination of adult lifespan [GO:0008340]; intracellular potassium ion homeostasis [GO:0030007]; intracellular sodium ion homeostasis [GO:0006883]; jump response [GO:0007630]; locomotory behavior [GO:0007626]; monoatomic cation transport [GO:0006812]; neuromuscular process [GO:0050905]; potassium ion import across plasma membrane [GO:1990573]; proton transmembrane transport [GO:1902600]; regulation of tube diameter, open tracheal system [GO:0035158]; regulation of tube length, open tracheal system [GO:0035159]; response to mechanical stimulus [GO:0009612]; response to temperature stimulus [GO:0009266]; sensory perception of sound [GO:0007605]; septate junction assembly [GO:0019991]; sodium ion export across plasma membrane [GO:0036376]; synaptic assembly at neuromuscular junction [GO:0051124]; tissue homeostasis [GO:0001894]; trachea morphogenesis [GO:0060439]",GO:0001894; GO:0005391; GO:0005524; GO:0005634; GO:0005737; GO:0005886; GO:0005890; GO:0005918; GO:0006812; GO:0006883; GO:0007268; GO:0007605; GO:0007626; GO:0007630; GO:0008340; GO:0008344; GO:0009266; GO:0009612; GO:0016323; GO:0016887; GO:0019991; GO:0030007; GO:0035158; GO:0035159; GO:0036376; GO:0045202; GO:0050905; GO:0051124; GO:0060439; GO:1902600; GO:1990573,basolateral plasma membrane [GO:0016323]; cytoplasm [GO:0005737]; nucleus [GO:0005634]; plasma membrane [GO:0005886]; septate junction [GO:0005918]; sodium:potassium-exchanging ATPase complex [GO:0005890]; synapse [GO:0045202],ATP binding [GO:0005524]; ATP hydrolysis activity [GO:0016887]; P-type sodium:potassium-exchanging transporter activity [GO:0005391],ATP1A1
Pocillopora_acuta_HIv2___RNAseq.g17909.t1,Bhattacharya2016,NA,O16098,1.79e-134,Maltase 1 (EC 3.2.1.20),carbohydrate metabolic process [GO:0005975],GO:0004558; GO:0005975,,"alpha-1,4-glucosidase activity [GO:0004558]",NA
