query,gene_set,Bhattacharya_ID,blast_hit,evalue,ProteinNames,BiologicalProcess,GOs,CellularComponent,MolecularFunction,short_name
Pocillopora_acuta_HIv2___RNAseq.g9443.t1,"TRP, calcium",,Q8BLA8,7.62e-129,Transient receptor potential cation channel subfamily A member 1 (Ankyrin-like with transmembrane domains protein 1) (Wasabi receptor),calcium ion transmembrane import into cytosol [GO:0097553]; calcium ion transport [GO:0006816]; cell surface receptor signaling pathway [GO:0007166]; cellular response to caffeine [GO:0071313]; cellular response to carbon dioxide [GO:0071244]; cellular response to cold [GO:0070417]; cellular response to food [GO:0071240]; cellular response to heat [GO:0034605]; cellular response to hydrogen peroxide [GO:0070301]; cellular response to toxic substance [GO:0097237]; detection of chemical stimulus involved in sensory perception of pain [GO:0050968]; detection of mechanical stimulus involved in sensory perception [GO:0050974]; detection of mechanical stimulus involved in sensory perception of pain [GO:0050966]; intracellular calcium ion homeostasis [GO:0006874]; positive regulation of insulin secretion involved in cellular response to glucose stimulus [GO:0035774]; positive regulation of monoatomic anion transport [GO:1903793]; protein homotetramerization [GO:0051289]; regulation of blood circulation [GO:1903522]; regulation of neuronal action potential [GO:0098908]; response to cold [GO:0009409]; response to hydrogen peroxide [GO:0042542]; response to pain [GO:0048265]; response to xenobiotic stimulus [GO:0009410]; thermoception [GO:0050955]; urinary bladder smooth muscle contraction [GO:0014832],GO:0005216; GO:0005245; GO:0005262; GO:0005886; GO:0006816; GO:0006874; GO:0007166; GO:0009409; GO:0009410; GO:0014832; GO:0015267; GO:0015278; GO:0016020; GO:0016324; GO:0030424; GO:0032421; GO:0034605; GO:0035774; GO:0042542; GO:0042802; GO:0046872; GO:0048265; GO:0050955; GO:0050966; GO:0050968; GO:0050974; GO:0051289; GO:0070301; GO:0070417; GO:0071240; GO:0071244; GO:0071313; GO:0097237; GO:0097553; GO:0097604; GO:0098908; GO:1903522; GO:1903793; GO:1990760,apical plasma membrane [GO:0016324]; axon [GO:0030424]; membrane [GO:0016020]; plasma membrane [GO:0005886]; stereocilium bundle [GO:0032421],calcium channel activity [GO:0005262]; channel activity [GO:0015267]; identical protein binding [GO:0042802]; intracellularly gated calcium channel activity [GO:0015278]; metal ion binding [GO:0046872]; monoatomic ion channel activity [GO:0005216]; osmolarity-sensing monoatomic cation channel activity [GO:1990760]; temperature-gated cation channel activity [GO:0097604]; voltage-gated calcium channel activity [GO:0005245],Transient receptor potential cation channel subfamily A member 1
Pocillopora_acuta_HIv2___RNAseq.g9444.t1,TRP,,O75762,1.15e-129,Transient receptor potential cation channel subfamily A member 1 (Ankyrin-like with transmembrane domains protein 1) (Transformation-sensitive protein p120) (p120) (Wasabi receptor),calcium ion transmembrane import into cytosol [GO:0097553]; calcium ion transmembrane transport [GO:0070588]; cell surface receptor signaling pathway [GO:0007166]; cellular response to caffeine [GO:0071313]; cellular response to carbon dioxide [GO:0071244]; cellular response to cold [GO:0070417]; cellular response to food [GO:0071240]; cellular response to heat [GO:0034605]; cellular response to hydrogen peroxide [GO:0070301]; cellular response to toxic substance [GO:0097237]; detection of chemical stimulus involved in sensory perception of pain [GO:0050968]; detection of mechanical stimulus involved in sensory perception of pain [GO:0050966]; intracellular calcium ion homeostasis [GO:0006874]; monoatomic ion transport [GO:0006811]; positive regulation of insulin secretion involved in cellular response to glucose stimulus [GO:0035774]; positive regulation of monoatomic anion transport [GO:1903793]; protein homotetramerization [GO:0051289]; regulation of blood circulation [GO:1903522]; regulation of neuronal action potential [GO:0098908]; response to cold [GO:0009409]; response to pain [GO:0048265]; response to xenobiotic stimulus [GO:0009410]; sensory perception of pain [GO:0019233]; thermoception [GO:0050955]; urinary bladder smooth muscle contraction [GO:0014832],GO:0005245; GO:0005262; GO:0005886; GO:0006811; GO:0006874; GO:0007166; GO:0009409; GO:0009410; GO:0014832; GO:0015267; GO:0015278; GO:0016324; GO:0019233; GO:0030424; GO:0032421; GO:0034605; GO:0035774; GO:0042802; GO:0048265; GO:0050955; GO:0050966; GO:0050968; GO:0051289; GO:0070301; GO:0070417; GO:0070588; GO:0071240; GO:0071244; GO:0071313; GO:0097237; GO:0097553; GO:0097604; GO:0098908; GO:1903522; GO:1903793; GO:1990760,apical plasma membrane [GO:0016324]; axon [GO:0030424]; plasma membrane [GO:0005886]; stereocilium bundle [GO:0032421],calcium channel activity [GO:0005262]; channel activity [GO:0015267]; identical protein binding [GO:0042802]; intracellularly gated calcium channel activity [GO:0015278]; osmolarity-sensing monoatomic cation channel activity [GO:1990760]; temperature-gated cation channel activity [GO:0097604]; voltage-gated calcium channel activity [GO:0005245],Transient receptor potential cation channel subfamily A member 1
Pocillopora_acuta_HIv2___RNAseq.g9466.t1,"TRP, calcium",,Q6RI86,1.07e-142,Transient receptor potential cation channel subfamily A member 1 (Ankyrin-like with transmembrane domains protein 1) (Wasabi receptor),calcium ion transmembrane import into cytosol [GO:0097553]; calcium ion transmembrane transport [GO:0070588]; calcium ion transport [GO:0006816]; cell surface receptor signaling pathway [GO:0007166]; cellular response to caffeine [GO:0071313]; cellular response to carbon dioxide [GO:0071244]; cellular response to cold [GO:0070417]; cellular response to food [GO:0071240]; cellular response to heat [GO:0034605]; cellular response to hydrogen peroxide [GO:0070301]; cellular response to toxic substance [GO:0097237]; detection of chemical stimulus involved in sensory perception of pain [GO:0050968]; detection of mechanical stimulus involved in sensory perception [GO:0050974]; detection of mechanical stimulus involved in sensory perception of pain [GO:0050966]; intracellular calcium ion homeostasis [GO:0006874]; positive regulation of insulin secretion involved in cellular response to glucose stimulus [GO:0035774]; positive regulation of monoatomic anion transport [GO:1903793]; protein homotetramerization [GO:0051289]; regulation of blood circulation [GO:1903522]; regulation of neuronal action potential [GO:0098908]; response to cold [GO:0009409]; response to hydrogen peroxide [GO:0042542]; response to pain [GO:0048265]; response to xenobiotic stimulus [GO:0009410]; sensory perception of pain [GO:0019233]; thermoception [GO:0050955]; urinary bladder smooth muscle contraction [GO:0014832],GO:0005216; GO:0005245; GO:0005262; GO:0005886; GO:0006816; GO:0006874; GO:0007166; GO:0009409; GO:0009410; GO:0014832; GO:0015267; GO:0015278; GO:0016324; GO:0019233; GO:0030424; GO:0032421; GO:0034605; GO:0035774; GO:0042542; GO:0042802; GO:0046872; GO:0048265; GO:0050955; GO:0050966; GO:0050968; GO:0050974; GO:0051289; GO:0070301; GO:0070417; GO:0070588; GO:0071240; GO:0071244; GO:0071313; GO:0097237; GO:0097553; GO:0097604; GO:0098908; GO:1903522; GO:1903793; GO:1990760,apical plasma membrane [GO:0016324]; axon [GO:0030424]; plasma membrane [GO:0005886]; stereocilium bundle [GO:0032421],calcium channel activity [GO:0005262]; channel activity [GO:0015267]; identical protein binding [GO:0042802]; intracellularly gated calcium channel activity [GO:0015278]; metal ion binding [GO:0046872]; monoatomic ion channel activity [GO:0005216]; osmolarity-sensing monoatomic cation channel activity [GO:1990760]; temperature-gated cation channel activity [GO:0097604]; voltage-gated calcium channel activity [GO:0005245],Transient receptor potential cation channel subfamily A member 1
Pocillopora_acuta_HIv2___RNAseq.g9547.t1,Bhattacharya2016,HSPA6,P63018,0,Heat shock cognate 71 kDa protein (EC 3.6.4.10) (Heat shock 70 kDa protein 8),"ATP metabolic process [GO:0046034]; axo-dendritic transport [GO:0008088]; cellular response to cadmium ion [GO:0071276]; cellular response to heat [GO:0034605]; cellular response to hydrogen peroxide [GO:0070301]; cerebellum development [GO:0021549]; chaperone cofactor-dependent protein refolding [GO:0051085]; chaperone-mediated autophagy [GO:0061684]; chaperone-mediated autophagy translocation complex disassembly [GO:1904764]; chaperone-mediated protein folding [GO:0061077]; clathrin coat disassembly [GO:0072318]; estrous cycle [GO:0044849]; forebrain development [GO:0030900]; G1/S transition of mitotic cell cycle [GO:0000082]; kidney development [GO:0001822]; late endosomal microautophagy [GO:0061738]; maintenance of postsynaptic specialization structure [GO:0098880]; modulation by host of viral process [GO:0044788]; mRNA processing [GO:0006397]; negative regulation of cardiac muscle cell apoptotic process [GO:0010667]; negative regulation of DNA-templated transcription [GO:0045892]; negative regulation of NLRP3 inflammasome complex assembly [GO:1900226]; negative regulation of supramolecular fiber organization [GO:1902904]; positive regulation by host of viral genome replication [GO:0044829]; positive regulation of cell migration [GO:0030335]; positive regulation of gene expression [GO:0010628]; positive regulation of lysosomal membrane permeability [GO:0097214]; positive regulation of mRNA splicing, via spliceosome [GO:0048026]; positive regulation of phagocytosis [GO:0050766]; positive regulation of protein refolding [GO:1904592]; positive regulation of proteolysis [GO:0045862]; positive regulation of T cell mediated cytotoxicity [GO:0001916]; protein folding [GO:0006457]; protein import into nucleus [GO:0006606]; protein refolding [GO:0042026]; protein targeting to lysosome involved in chaperone-mediated autophagy [GO:0061740]; protein transmembrane import into intracellular organelle [GO:0044743]; protein-containing complex disassembly [GO:0032984]; regulation of cell cycle [GO:0051726]; regulation of postsynapse organization [GO:0099175]; regulation of protein complex stability [GO:0061635]; regulation of protein stability [GO:0031647]; response to activity [GO:0014823]; response to estradiol [GO:0032355]; response to ethanol [GO:0045471]; response to nickel cation [GO:0010045]; response to odorant [GO:1990834]; response to progesterone [GO:0032570]; response to starvation [GO:0042594]; response to xenobiotic stimulus [GO:0009410]; RNA splicing [GO:0008380]; skeletal muscle tissue development [GO:0007519]; slow axonal transport [GO:1990832]",GO:0000082; GO:0000974; GO:0001664; GO:0001786; GO:0001822; GO:0001916; GO:0001917; GO:0003723; GO:0005102; GO:0005524; GO:0005615; GO:0005634; GO:0005681; GO:0005730; GO:0005737; GO:0005765; GO:0005770; GO:0005776; GO:0005829; GO:0005874; GO:0005882; GO:0005886; GO:0006397; GO:0006457; GO:0006606; GO:0007519; GO:0008021; GO:0008088; GO:0008380; GO:0009410; GO:0009986; GO:0010045; GO:0010628; GO:0010667; GO:0014069; GO:0014823; GO:0016887; GO:0019899; GO:0021549; GO:0030335; GO:0030424; GO:0030425; GO:0030674; GO:0030900; GO:0031072; GO:0031625; GO:0031647; GO:0031686; GO:0032279; GO:0032355; GO:0032570; GO:0032984; GO:0032991; GO:0034605; GO:0042026; GO:0042277; GO:0042470; GO:0042594; GO:0043025; GO:0043195; GO:0043197; GO:0043198; GO:0043202; GO:0043204; GO:0043531; GO:0044183; GO:0044309; GO:0044743; GO:0044788; GO:0044829; GO:0044849; GO:0045471; GO:0045862; GO:0045892; GO:0046034; GO:0048018; GO:0048026; GO:0048471; GO:0050766; GO:0051082; GO:0051085; GO:0051087; GO:0051726; GO:0055131; GO:0061077; GO:0061635; GO:0061684; GO:0061738; GO:0061740; GO:0070062; GO:0070301; GO:0071276; GO:0072318; GO:0097214; GO:0098684; GO:0098690; GO:0098793; GO:0098794; GO:0098880; GO:0098978; GO:0099175; GO:0099634; GO:0101031; GO:0140545; GO:0140662; GO:1900226; GO:1902904; GO:1904592; GO:1904593; GO:1904764; GO:1990832; GO:1990833; GO:1990834; GO:1990836; GO:1990904,asymmetric synapse [GO:0032279]; autophagosome [GO:0005776]; axon [GO:0030424]; cell surface [GO:0009986]; cytoplasm [GO:0005737]; cytosol [GO:0005829]; dendrite [GO:0030425]; dendritic shaft [GO:0043198]; dendritic spine [GO:0043197]; extracellular exosome [GO:0070062]; extracellular space [GO:0005615]; glutamatergic synapse [GO:0098978]; glycinergic synapse [GO:0098690]; intermediate filament [GO:0005882]; late endosome [GO:0005770]; lysosomal lumen [GO:0043202]; lysosomal matrix [GO:1990836]; lysosomal membrane [GO:0005765]; melanosome [GO:0042470]; microtubule [GO:0005874]; neuron spine [GO:0044309]; neuronal cell body [GO:0043025]; nucleolus [GO:0005730]; nucleus [GO:0005634]; perikaryon [GO:0043204]; perinuclear region of cytoplasm [GO:0048471]; photoreceptor inner segment [GO:0001917]; photoreceptor ribbon synapse [GO:0098684]; plasma membrane [GO:0005886]; postsynapse [GO:0098794]; postsynaptic density [GO:0014069]; postsynaptic specialization membrane [GO:0099634]; presynapse [GO:0098793]; protein folding chaperone complex [GO:0101031]; protein-containing complex [GO:0032991]; Prp19 complex [GO:0000974]; ribonucleoprotein complex [GO:1990904]; spliceosomal complex [GO:0005681]; synaptic vesicle [GO:0008021]; terminal bouton [GO:0043195],A1 adenosine receptor binding [GO:0031686]; ADP binding [GO:0043531]; ATP binding [GO:0005524]; ATP hydrolysis activity [GO:0016887]; ATP-dependent protein disaggregase activity [GO:0140545]; ATP-dependent protein folding chaperone [GO:0140662]; C3HC4-type RING finger domain binding [GO:0055131]; clathrin-uncoating ATPase activity [GO:1990833]; enzyme binding [GO:0019899]; G protein-coupled receptor binding [GO:0001664]; heat shock protein binding [GO:0031072]; peptide binding [GO:0042277]; phosphatidylserine binding [GO:0001786]; prostaglandin binding [GO:1904593]; protein folding chaperone [GO:0044183]; protein-folding chaperone binding [GO:0051087]; protein-macromolecule adaptor activity [GO:0030674]; receptor ligand activity [GO:0048018]; RNA binding [GO:0003723]; signaling receptor binding [GO:0005102]; ubiquitin protein ligase binding [GO:0031625]; unfolded protein binding [GO:0051082],HSPA6
Pocillopora_acuta_HIv2___RNAseq.g9961.t1,Bhattacharya2016,CFTR,O15439,0,ATP-binding cassette sub-family C member 4 (EC 7.6.2.-) (EC 7.6.2.2) (EC 7.6.2.3) (MRP/cMOAT-related ABC transporter) (Multi-specific organic anion transporter B) (MOAT-B) (Multidrug resistance-associated protein 4),bile acid and bile salt transport [GO:0015721]; cAMP transport [GO:0070730]; cilium assembly [GO:0060271]; export across plasma membrane [GO:0140115]; leukotriene transport [GO:0071716]; platelet degranulation [GO:0002576]; prostaglandin secretion [GO:0032310]; prostaglandin transport [GO:0015732]; transmembrane transport [GO:0055085]; transport across blood-brain barrier [GO:0150104]; urate transport [GO:0015747]; xenobiotic metabolic process [GO:0006805]; xenobiotic transmembrane transport [GO:0006855],GO:0001409; GO:0002576; GO:0005524; GO:0005730; GO:0005794; GO:0005886; GO:0006805; GO:0006855; GO:0008559; GO:0015132; GO:0015143; GO:0015216; GO:0015431; GO:0015432; GO:0015562; GO:0015721; GO:0015732; GO:0015747; GO:0016020; GO:0016323; GO:0016324; GO:0016404; GO:0016887; GO:0031088; GO:0032310; GO:0034634; GO:0042626; GO:0042910; GO:0043225; GO:0043231; GO:0055085; GO:0060271; GO:0070730; GO:0071716; GO:0098591; GO:0140115; GO:0140359; GO:0150104,apical plasma membrane [GO:0016324]; basolateral plasma membrane [GO:0016323]; external side of apical plasma membrane [GO:0098591]; Golgi apparatus [GO:0005794]; intracellular membrane-bounded organelle [GO:0043231]; membrane [GO:0016020]; nucleolus [GO:0005730]; plasma membrane [GO:0005886]; platelet dense granule membrane [GO:0031088],15-hydroxyprostaglandin dehydrogenase (NAD+) activity [GO:0016404]; ABC-type bile acid transporter activity [GO:0015432]; ABC-type glutathione S-conjugate transporter activity [GO:0015431]; ABC-type transporter activity [GO:0140359]; ABC-type xenobiotic transporter activity [GO:0008559]; ATP binding [GO:0005524]; ATP hydrolysis activity [GO:0016887]; ATPase-coupled inorganic anion transmembrane transporter activity [GO:0043225]; ATPase-coupled transmembrane transporter activity [GO:0042626]; efflux transmembrane transporter activity [GO:0015562]; glutathione transmembrane transporter activity [GO:0034634]; guanine nucleotide transmembrane transporter activity [GO:0001409]; prostaglandin transmembrane transporter activity [GO:0015132]; purine nucleotide transmembrane transporter activity [GO:0015216]; urate transmembrane transporter activity [GO:0015143]; xenobiotic transmembrane transporter activity [GO:0042910],CFTR
Pocillopora_acuta_HIv2___TS.g10013.t3,calcium,,Q5R4U9,1.08e-74,Sorcin,calcium ion transport [GO:0006816]; negative regulation of cardiac muscle contraction [GO:0055118]; negative regulation of heart rate [GO:0010459]; positive regulation of release of sequestered calcium ion into cytosol [GO:0051281]; regulation of cardiac muscle cell contraction [GO:0086004]; regulation of cell communication by electrical coupling involved in cardiac conduction [GO:1901844]; regulation of insulin secretion involved in cellular response to glucose stimulus [GO:0061178]; regulation of relaxation of muscle [GO:1901077]; regulation of release of sequestered calcium ion into cytosol by sarcoplasmic reticulum [GO:0010880],GO:0002020; GO:0005509; GO:0005654; GO:0005829; GO:0005886; GO:0006816; GO:0010459; GO:0010880; GO:0030018; GO:0033017; GO:0042584; GO:0046982; GO:0051281; GO:0055118; GO:0061178; GO:0070062; GO:0086004; GO:0140297; GO:0140311; GO:0140416; GO:1901077; GO:1901844,chromaffin granule membrane [GO:0042584]; cytosol [GO:0005829]; extracellular exosome [GO:0070062]; nucleoplasm [GO:0005654]; plasma membrane [GO:0005886]; sarcoplasmic reticulum membrane [GO:0033017]; Z disc [GO:0030018],calcium ion binding [GO:0005509]; DNA-binding transcription factor binding [GO:0140297]; protease binding [GO:0002020]; protein heterodimerization activity [GO:0046982]; protein sequestering activity [GO:0140311]; transcription regulator inhibitor activity [GO:0140416],Sorcin
Pocillopora_acuta_HIv2___TS.g11056.t1,"calcium, ER_calcium",,Q16611,4.25e-39,Bcl-2 homologous antagonist/killer (Apoptosis regulator BAK) (Bcl-2-like protein 7) (Bcl2-L-7),animal organ regeneration [GO:0031100]; apoptotic process [GO:0006915]; apoptotic process involved in blood vessel morphogenesis [GO:1902262]; apoptotic signaling pathway [GO:0097190]; B cell apoptotic process [GO:0001783]; B cell homeostasis [GO:0001782]; B cell negative selection [GO:0002352]; blood vessel remodeling [GO:0001974]; calcium ion transport into cytosol [GO:0060402]; cellular response to mechanical stimulus [GO:0071260]; cellular response to unfolded protein [GO:0034620]; cellular response to UV [GO:0034644]; endocrine pancreas development [GO:0031018]; endoplasmic reticulum calcium ion homeostasis [GO:0032469]; epithelial cell proliferation [GO:0050673]; establishment of localization in cell [GO:0051649]; establishment or maintenance of transmembrane electrochemical gradient [GO:0010248]; extrinsic apoptotic signaling pathway in absence of ligand [GO:0097192]; fibroblast apoptotic process [GO:0044346]; intrinsic apoptotic signaling pathway [GO:0097193]; intrinsic apoptotic signaling pathway in response to DNA damage [GO:0008630]; intrinsic apoptotic signaling pathway in response to endoplasmic reticulum stress [GO:0070059]; limb morphogenesis [GO:0035108]; mitochondrial fusion [GO:0008053]; myeloid cell homeostasis [GO:0002262]; negative regulation of cell population proliferation [GO:0008285]; negative regulation of endoplasmic reticulum calcium ion concentration [GO:0032471]; negative regulation of gene expression [GO:0010629]; negative regulation of mitochondrial outer membrane permeabilization involved in apoptotic signaling pathway [GO:1901029]; negative regulation of release of cytochrome c from mitochondria [GO:0090201]; positive regulation of apoptotic process [GO:0043065]; positive regulation of calcium ion transport into cytosol [GO:0010524]; positive regulation of IRE1-mediated unfolded protein response [GO:1903896]; positive regulation of mitochondrial outer membrane permeabilization involved in apoptotic signaling pathway [GO:1901030]; positive regulation of protein-containing complex assembly [GO:0031334]; positive regulation of proteolysis [GO:0045862]; positive regulation of release of cytochrome c from mitochondria [GO:0090200]; post-embryonic camera-type eye morphogenesis [GO:0048597]; regulation of cell cycle [GO:0051726]; regulation of mitochondrial membrane permeability [GO:0046902]; regulation of mitochondrial membrane potential [GO:0051881]; release of cytochrome c from mitochondria [GO:0001836]; response to ethanol [GO:0045471]; response to fungus [GO:0009620]; response to gamma radiation [GO:0010332]; response to hydrogen peroxide [GO:0042542]; response to mycotoxin [GO:0010046]; response to UV-C [GO:0010225]; response to xenobiotic stimulus [GO:0009410]; thymocyte apoptotic process [GO:0070242]; vagina development [GO:0060068],GO:0001782; GO:0001783; GO:0001836; GO:0001974; GO:0002262; GO:0002352; GO:0005739; GO:0005741; GO:0005783; GO:0005829; GO:0006915; GO:0008053; GO:0008285; GO:0008630; GO:0009410; GO:0009620; GO:0010046; GO:0010225; GO:0010248; GO:0010332; GO:0010524; GO:0010629; GO:0015267; GO:0015288; GO:0031018; GO:0031072; GO:0031100; GO:0031334; GO:0032469; GO:0032471; GO:0034620; GO:0034644; GO:0035108; GO:0042542; GO:0042802; GO:0042803; GO:0043065; GO:0044325; GO:0044346; GO:0044877; GO:0045471; GO:0045862; GO:0046872; GO:0046902; GO:0046930; GO:0046982; GO:0048597; GO:0050673; GO:0051087; GO:0051400; GO:0051649; GO:0051726; GO:0051881; GO:0060068; GO:0060402; GO:0070059; GO:0070242; GO:0071260; GO:0090200; GO:0090201; GO:0097136; GO:0097145; GO:0097190; GO:0097192; GO:0097193; GO:1901029; GO:1901030; GO:1902262; GO:1903896,BAK complex [GO:0097145]; Bcl-2 family protein complex [GO:0097136]; cytosol [GO:0005829]; endoplasmic reticulum [GO:0005783]; mitochondrial outer membrane [GO:0005741]; mitochondrion [GO:0005739]; pore complex [GO:0046930],BH domain binding [GO:0051400]; channel activity [GO:0015267]; heat shock protein binding [GO:0031072]; identical protein binding [GO:0042802]; metal ion binding [GO:0046872]; porin activity [GO:0015288]; protein heterodimerization activity [GO:0046982]; protein homodimerization activity [GO:0042803]; protein-containing complex binding [GO:0044877]; protein-folding chaperone binding [GO:0051087]; transmembrane transporter binding [GO:0044325],Bcl-2 homologous antagonist/killer
Pocillopora_acuta_HIv2___TS.g11592.t1b,calcium,,P54131,4.65e-84,Neuronal acetylcholine receptor subunit alpha-7 (nAChR7) (Nicotinic acetylcholine receptor subunit alpha-7),"calcium ion transport [GO:0006816]; chemical synaptic transmission [GO:0007268]; cognition [GO:0050890]; intracellular calcium ion homeostasis [GO:0006874]; monoatomic ion transmembrane transport [GO:0034220]; negative regulation of cytokine production involved in inflammatory response [GO:1900016]; negative regulation of tumor necrosis factor production [GO:0032720]; positive regulation of angiogenesis [GO:0045766]; positive regulation of cell population proliferation [GO:0008284]; positive regulation of MAPK cascade [GO:0043410]; regulation of membrane potential [GO:0042391]; response to hypoxia [GO:0001666]; response to nicotine [GO:0035094]; signal transduction [GO:0007165]; synaptic transmission, cholinergic [GO:0007271]",GO:0001540; GO:0001666; GO:0005886; GO:0005892; GO:0006816; GO:0006874; GO:0007165; GO:0007268; GO:0007271; GO:0008284; GO:0015464; GO:0015643; GO:0017081; GO:0022848; GO:0030425; GO:0032720; GO:0034220; GO:0035094; GO:0042166; GO:0042391; GO:0042803; GO:0043005; GO:0043410; GO:0045202; GO:0045211; GO:0045766; GO:0050890; GO:1900016,acetylcholine-gated channel complex [GO:0005892]; dendrite [GO:0030425]; neuron projection [GO:0043005]; plasma membrane [GO:0005886]; postsynaptic membrane [GO:0045211]; synapse [GO:0045202],acetylcholine binding [GO:0042166]; acetylcholine receptor activity [GO:0015464]; acetylcholine-gated monoatomic cation-selective channel activity [GO:0022848]; amyloid-beta binding [GO:0001540]; chloride channel regulator activity [GO:0017081]; protein homodimerization activity [GO:0042803]; toxic substance binding [GO:0015643],Neuronal acetylcholine receptor subunit alpha-7
